{
  "$schema": "schemas/catalog.schema.json",
  "schema_version": 1,
  "catalog_version": 5,
  "device": {
    "manufacturer": "Sonicake",
    "model": "Matribox II Pro"
  },
  "class_indexes": [
    "effects/freq/index.json",
    "effects/drv/index.json",
    "effects/dyn/index.json",
    "effects/wah/index.json",
    "effects/amp/index.json",
    "effects/cab/index.json",
    "effects/ir/index.json",
    "effects/eq/index.json",
    "effects/mod/index.json",
    "effects/dly/index.json",
    "effects/rvb/index.json",
    "effects/clone/index.json",
    "effects/fx_loop/index.json",
    "effects/fx_send/index.json",
    "effects/fx_return/index.json",
    "effects/vol/index.json"
  ],
  "protocol_profiles": [
    "protocol_profiles/effect_parameter_response_1c_v1.json"
  ],
  "value_codecs": [
    "value_codecs/upper_float32_nibbles_v1.json"
  ]
}
